title,body,rating
Ehh it's OK,Affordable? Yes. Comfortable? Not so much. The 1st couple of days it was pretty comfortable but as the weeks went on it started to get more and more harder and harder to sit on for long periods of time. Doesn't support my back the way I wish it would and the chair was starting to squeak and pop less then a month of owning it; I'm not sure why I'm only 5'6 &132lbs so I ended up returning it.,3
Awesome chair !,I got this chair for my boyfriend for his birthday and he absolutely loves it. He says it is super comfortable and lives the foot rest it comes with. Pretty durable and supports well. Plus the pillow it comes with has a massaging type for your back!( usb port not outlet to wall) the foot rest isn’t hard to pull out but it id alittle hassle. The recline I. The chair is pretty awesome you can practically sleep in it on how far back it goes.,5
broke after a few months **edited**,"cheap parts, not worth the value, metal bends and break at certain angles if not careful**update*despite the chair breaking, the chair was very comfy and soft, i did enjoy the little back massager that the chair came with and the pillow for extra comfort,great customer services, they reached out pretty quick",5
Not recommended,Bought for less a month. The feet pad is completely useless(cannot hold its position). The sitting pad got broken from inside one day (hear the crack sound) so you easily slew to the floor when sitting on it.,2
Super nice!,"The chair itself is really nice, everything went on tightly, no wiggles on the arm rests THANK GOD. Sitting on the chair it’s pretty firm which I personally don’t mind because overtime it’ll break in and I’ll wish it was firmer. Super big fan of the fabric! I have always had the faux leather stuff and it would eventually just crack and peel away after 3 years so I’m hoping this chair will last longer for me.",4
